{
  "$schema": "https://json-schema.org/draft/2020-12/schema",
  "$id": "https://raw.githubusercontent.com/Adrian01987/RestLib/main/schemas/restlib-resource.schema.json",
  "title": "RestLib Resource Configuration",
  "description": "JSON schema for configuring a single RestLib REST API resource in a root-level JSON file or appsettings section.",
  "type": "object",
  "properties": {
    "$schema": {
      "type": "string",
      "description": "Optional schema reference for IDE autocomplete when authoring standalone resource files."
    },
    "Name": {
      "type": "string",
      "description": "Unique resource name used during registration."
    },
    "Route": {
      "type": "string",
      "description": "Route prefix for the resource (e.g. /api/products).",
      "pattern": "^/"
    },
    "EntityType": {
      "type": "string",
      "description": "Assembly-qualified CLR API model type name used by AddRestLibFromFolder. For single-model resources, this remains the entity type."
    },
    "Mapping": {
      "$ref": "#/$defs/mappingConfiguration"
    },
    "KeyProperty": {
      "type": "string",
      "description": "Entity property name used as the primary key. Defaults to 'Id' when omitted."
    },
    "Key": {
      "$ref": "#/$defs/keyConfiguration"
    },
    "AllowAnonymous": {
      "type": "array",
      "description": "Operations that allow anonymous (unauthenticated) access.",
      "items": { "$ref": "#/$defs/operation" },
      "uniqueItems": true
    },
    "AllowAnonymousAll": {
      "type": "boolean",
      "description": "When true, all operations allow anonymous access.",
      "default": false
    },
    "Operations": {
      "$ref": "#/$defs/operationSelection"
    },
    "Policies": {
      "type": "object",
      "description": "Authorization policies required for specific operations. Keys are operation names, values are arrays of policy names.",
      "propertyNames": { "$ref": "#/$defs/operation" },
      "additionalProperties": {
        "type": "array",
        "items": { "type": "string" },
        "minItems": 1
      }
    },
    "Filtering": {
      "type": "array",
      "description": "API model property names or dot-separated nested reference-property paths that can be filtered on via query parameters (equality only). Names are converted to snake_case per segment in the query string, joined with dots (for example, Customer.Email -> customer.email). Collection-valued paths are not supported. For operator-based filtering, use FilteringOperators instead.",
      "items": { "type": "string" },
      "uniqueItems": true
    },
    "FilteringOperators": {
      "type": "object",
      "description": "Per-property filter operator configuration. Keys are API model property names or dot-separated nested reference-property paths, values are arrays of allowed operator names or preset names. Query parameter names use snake_case per segment joined with dots. Collection-valued paths are not supported. Valid operators: eq, neq, gt, lt, gte, lte, contains, starts_with, ends_with, in. Valid presets: equality, comparison, string, all.",
      "additionalProperties": {
        "type": "array",
        "items": {
          "type": "string",
          "enum": ["eq", "neq", "gt", "lt", "gte", "lte", "contains", "starts_with", "ends_with", "in", "equality", "comparison", "string", "all"]
        },
        "uniqueItems": true,
        "minItems": 1
      }
    },
    "Sorting": {
      "type": "array",
      "description": "API model property names or dot-separated nested reference-property paths that can be sorted on via the sort query parameter. Names are converted to snake_case per segment and joined with dots (for example, Customer.Name -> customer.name). Collection-valued paths are not supported.",
      "items": { "type": "string" },
      "uniqueItems": true
    },
    "DefaultSort": {
      "type": "string",
      "description": "Default sort expression applied when the client does not provide a sort parameter (e.g. 'name:asc,price:desc' or 'customer.name:asc'). All referenced fields must also be listed in Sorting."
    },
    "FieldSelection": {
      "description": "API model property names or dot-separated nested reference-property paths that can be selected via the fields query parameter. Names are converted to snake_case per segment in the query string, joined with dots. The legacy array form uses flat dotted response keys by default. The additive object form can opt responses into consistently rebuilt nested objects. Collection-valued paths are not supported.",
      "oneOf": [
        {
          "type": "array",
          "items": { "type": "string" },
          "uniqueItems": true
        },
        {
          "$ref": "#/$defs/fieldSelectionConfiguration"
        }
      ]
    },
    "Search": {
      "type": "array",
      "description": "API model string property names or dot-separated nested reference-property paths that participate in OR-of-contains collection search. Search uses the configured query parameter, which defaults to q. Collection-valued paths are not supported.",
      "items": { "type": "string" },
      "uniqueItems": true
    },
    "SearchOptions": {
      "$ref": "#/$defs/searchOptions"
    },
    "Batch": {
      "$ref": "#/$defs/batchConfiguration"
    },
    "RateLimiting": {
      "$ref": "#/$defs/rateLimiting"
    },
    "OpenApi": {
      "$ref": "#/$defs/openApi"
    },
    "Hooks": {
      "$ref": "#/$defs/hookConfiguration"
    },
    "Validation": {
      "type": "object",
      "description": "JSON-declared validation rules keyed by API-model CLR property name.",
      "additionalProperties": {
        "$ref": "#/$defs/validationRule"
      }
    }
  },
  "required": ["Name", "Route"],
  "allOf": [
    {
      "not": {
        "required": ["KeyProperty", "Key"]
      }
    }
  ],
  "additionalProperties": false,
  "$defs": {
    "operation": {
      "type": "string",
      "enum": ["GetAll", "GetById", "Create", "Update", "Patch", "Delete", "BatchCreate", "BatchUpdate", "BatchPatch", "BatchDelete"],
      "description": "A RestLib CRUD operation."
    },
    "operationSelection": {
      "type": "object",
      "description": "Controls which CRUD operations are enabled. Use either Include or Exclude, not both.",
      "properties": {
        "Include": {
          "type": "array",
          "description": "Only these operations will be mapped. All others are disabled.",
          "items": { "$ref": "#/$defs/operation" },
          "uniqueItems": true
        },
        "Exclude": {
          "type": "array",
          "description": "These operations will not be mapped. All others remain enabled.",
          "items": { "$ref": "#/$defs/operation" },
          "uniqueItems": true
        }
      },
      "additionalProperties": false,
      "not": {
        "required": ["Include", "Exclude"],
        "properties": {
          "Include": { "minItems": 1 },
          "Exclude": { "minItems": 1 }
        }
      }
    },
    "mappingConfiguration": {
      "type": "object",
      "description": "Optional API-to-DB model mapping configuration.",
      "properties": {
        "DbType": {
          "type": "string",
          "description": "Assembly-qualified CLR DB model type name."
        },
        "Mapper": {
          "type": "string",
          "description": "Mapper implementation type name used to select a registered C# mapper."
        },
        "Auto": {
          "type": "boolean",
          "description": "When true, RestLib uses the built-in strict reflection mapper for exact same-name, same-type properties.",
          "default": false
        },
        "HookModel": {
          "type": "string",
          "description": "Selects whether named JSON hooks run against the API or DB model.",
          "enum": ["Api", "Db"],
          "default": "Api"
        }
      },
      "additionalProperties": false,
      "not": {
        "required": ["Mapper", "Auto"],
        "properties": {
          "Auto": { "const": true }
        }
      }
    },
    "fieldSelectionConfiguration": {
      "type": "object",
      "description": "Additive field-selection configuration. Use Properties to declare selectable fields and Response to opt nested selections into rebuilt nested JSON objects.",
      "properties": {
        "Properties": {
          "type": "array",
          "description": "API model property names or dot-separated nested reference-property paths that can be selected via the fields query parameter.",
          "items": { "type": "string" },
          "uniqueItems": true
        },
        "Response": {
          "type": "string",
          "description": "Nested response shape. Flat keeps dotted keys. Nested consistently rebuilds nested objects regardless of the internal projection strategy.",
          "enum": ["Flat", "Nested", "flat", "nested"]
        }
      },
      "required": ["Properties"],
      "additionalProperties": false
    },
    "keyConfiguration": {
      "type": "object",
      "description": "Ordered two-part composite key configuration. Use this instead of KeyProperty for composite-key resources.",
      "properties": {
        "Properties": {
          "type": "array",
          "description": "Exactly two CLR property names that make up the key, in route order.",
          "items": { "type": "string" },
          "minItems": 2,
          "maxItems": 2
        },
        "RouteParameters": {
          "type": "array",
          "description": "Exactly two route parameter names used by the resource route, in route order.",
          "items": {
            "type": "string",
            "pattern": "^[A-Za-z_][A-Za-z0-9_]*$"
          },
          "minItems": 2,
          "maxItems": 2,
          "uniqueItems": true
        }
      },
      "required": ["Properties", "RouteParameters"],
      "additionalProperties": false
    },
    "openApi": {
      "type": "object",
      "description": "OpenAPI (Swagger) metadata for the resource.",
      "properties": {
        "Tag": {
          "type": "string",
          "description": "Shared tag name for grouping endpoints in the OpenAPI document."
        },
        "TagDescription": {
          "type": "string",
          "description": "Description for the OpenAPI tag."
        },
        "Deprecated": {
          "type": "boolean",
          "description": "Marks all operations as deprecated in the OpenAPI document.",
          "default": false
        },
        "DeprecationMessage": {
          "type": "string",
          "description": "Message displayed when the resource is deprecated."
        },
        "Summaries": {
          "type": "object",
          "description": "Short summary text for each operation in the OpenAPI document.",
          "propertyNames": { "$ref": "#/$defs/operation" },
          "additionalProperties": { "type": "string" }
        },
        "Descriptions": {
          "type": "object",
          "description": "Detailed description text for each operation in the OpenAPI document.",
          "propertyNames": { "$ref": "#/$defs/operation" },
          "additionalProperties": { "type": "string" }
        }
      },
      "additionalProperties": false
    },
    "searchOptions": {
      "type": "object",
      "description": "Optional collection search behavior overrides.",
      "properties": {
        "QueryParameter": {
          "type": "string",
          "description": "Query parameter name used for search. Defaults to 'q'."
        },
        "CaseSensitive": {
          "type": "boolean",
          "description": "When true, search uses case-sensitive string matching.",
          "default": false
        }
      },
      "additionalProperties": false
    },
    "rateLimiting": {
      "type": "object",
      "description": "Rate limiting policy configuration. Requires the application to register rate limiting policies via AddRateLimiter() and wire the middleware via UseRateLimiter().",
      "properties": {
        "Default": {
          "type": "string",
          "description": "Default rate limiting policy name applied to all operations. Per-operation overrides and disabled operations take precedence."
        },
        "ByOperation": {
          "type": "object",
          "description": "Per-operation rate limiting policy overrides. Keys are operation names, values are policy names.",
          "propertyNames": { "$ref": "#/$defs/operation" },
          "additionalProperties": { "type": "string" }
        },
        "Disabled": {
          "type": "array",
          "description": "Operations exempt from rate limiting.",
          "items": { "$ref": "#/$defs/operation" },
          "uniqueItems": true
        }
      },
      "additionalProperties": false
    },
    "batchConfiguration": {
      "type": "object",
      "description": "Batch operations configuration. Enables bulk create, update, patch, and/or delete via POST /prefix/batch.",
      "properties": {
        "Actions": {
          "type": "array",
          "description": "Batch actions to enable. If empty or omitted, all actions (Create, Update, Patch, Delete) are enabled.",
          "items": {
            "type": "string",
            "enum": ["Create", "Update", "Patch", "Delete"]
          },
          "uniqueItems": true
        }
      },
      "additionalProperties": false
    },
    "hookConfiguration": {
      "type": "object",
      "description": "Named hook handlers wired to pipeline stages. Hooks must be registered in C# via AddNamedHook/AddNamedErrorHook before use.",
      "properties": {
        "OnRequestReceived": {
          "$ref": "#/$defs/hookStage",
          "description": "Hooks that run when a request is first received."
        },
        "OnRequestValidated": {
          "$ref": "#/$defs/hookStage",
          "description": "Hooks that run after request validation."
        },
        "BeforePersist": {
          "$ref": "#/$defs/hookStage",
          "description": "Hooks that run before persistence."
        },
        "AfterPersist": {
          "$ref": "#/$defs/hookStage",
          "description": "Hooks that run after persistence."
        },
        "BeforeResponse": {
          "$ref": "#/$defs/hookStage",
          "description": "Hooks that run before the response is sent."
        },
        "OnError": {
          "$ref": "#/$defs/errorHookStage",
          "description": "Hooks that run when an exception occurs."
        }
      },
      "additionalProperties": false
    },
    "hookStage": {
      "type": "object",
      "description": "Configuration for a standard hook pipeline stage.",
      "properties": {
        "Default": {
          "type": "array",
          "description": "Hook names that always run for this stage, regardless of operation.",
          "items": { "type": "string" }
        },
        "ByOperation": {
          "type": "object",
          "description": "Hook names that run only for specific operations.",
          "propertyNames": { "$ref": "#/$defs/operation" },
          "additionalProperties": {
            "type": "array",
            "items": { "type": "string" }
          }
        }
      },
      "additionalProperties": false
    },
    "errorHookStage": {
      "type": "object",
      "description": "Configuration for the error hook pipeline stage.",
      "properties": {
        "Default": {
          "type": "array",
          "description": "Error hook names that always run, regardless of operation.",
          "items": { "type": "string" }
        },
        "ByOperation": {
          "type": "object",
          "description": "Error hook names that run only for specific operations.",
          "propertyNames": { "$ref": "#/$defs/operation" },
          "additionalProperties": {
            "type": "array",
            "items": { "type": "string" }
          }
        }
      },
      "additionalProperties": false
    },
    "validationRule": {
      "type": "object",
      "description": "Validation rules applied to a single CLR property.",
      "properties": {
        "Required": {
          "type": "boolean",
          "description": "When true, null and empty-string values are rejected."
        },
        "Min": {
          "type": "number",
          "description": "Minimum numeric value allowed for the property."
        },
        "Max": {
          "type": "number",
          "description": "Maximum numeric value allowed for the property."
        },
        "Length": {
          "$ref": "#/$defs/lengthValidation"
        },
        "Pattern": {
          "type": "string",
          "description": "Regular expression pattern a string value must match."
        },
        "Email": {
          "type": "boolean",
          "description": "When true, the string value must be a valid email address."
        }
      },
      "additionalProperties": false
    },
    "lengthValidation": {
      "type": "object",
      "description": "String length validation rules.",
      "properties": {
        "Min": {
          "type": "integer",
          "minimum": 0,
          "description": "Minimum allowed string length."
        },
        "Max": {
          "type": "integer",
          "minimum": 0,
          "description": "Maximum allowed string length."
        }
      },
      "additionalProperties": false
    }
  }
}
